{
 "modifiers": {
  "5": "pull toward the center — the ə-neighborhood (e⇧5→ɜ, o⇧5→ɞ, a⇧5→ɐ); ə itself is the 5 base's default, 5⇧H",
  "H": "the h-digraph — plosives spirantize (tH→θ, pH→ɸ), sibilants hush (sH→ʃ), vowels lax (iH→ɪ, uH→ʊ); for a, back (aH→ɑ)",
  "R": "retroflex (coronals)",
  "J": "palatalize (consonants only)",
  "W": "labialize / round-flip",
  "L": "lateralize",
  "G": "dorsal deepening — velar/uvular place",
  "Q": "guttural — uvular-pharyngeal-epiglottal throat region",
  "V": "labiodental",
  "B": "bilabial place",
  "A": "drag toward a (vowels: oA→ɒ, uA→ʌ)",
  "Y": "central — the y-vowels (iY→ɨ, uY→ʉ, eY→ɘ, oY→ɵ, aY→ä); Welsh y, Russian ы",
  "E": "ligature with e",
  "C": "click — base letter is the anterior place (p bilabial, t dental, q alveolar, c palatal, l lateral)",
  "P": "implosive (voiced glottalic ingressive)"
 },
 "letters": [
  {
   "key": "a",
   "glyph": "a",
   "cp": "U+0061",
   "name": "LATIN SMALL LETTER A"
  },
  {
   "key": "b",
   "glyph": "b",
   "cp": "U+0062",
   "name": "LATIN SMALL LETTER B"
  },
  {
   "key": "c",
   "glyph": "c",
   "cp": "U+0063",
   "name": "LATIN SMALL LETTER C"
  },
  {
   "key": "d",
   "glyph": "d",
   "cp": "U+0064",
   "name": "LATIN SMALL LETTER D"
  },
  {
   "key": "e",
   "glyph": "e",
   "cp": "U+0065",
   "name": "LATIN SMALL LETTER E"
  },
  {
   "key": "f",
   "glyph": "f",
   "cp": "U+0066",
   "name": "LATIN SMALL LETTER F"
  },
  {
   "key": "g",
   "glyph": "g",
   "cp": "U+0067",
   "name": "LATIN SMALL LETTER G"
  },
  {
   "key": "h",
   "glyph": "h",
   "cp": "U+0068",
   "name": "LATIN SMALL LETTER H"
  },
  {
   "key": "i",
   "glyph": "i",
   "cp": "U+0069",
   "name": "LATIN SMALL LETTER I"
  },
  {
   "key": "j",
   "glyph": "j",
   "cp": "U+006A",
   "name": "LATIN SMALL LETTER J"
  },
  {
   "key": "k",
   "glyph": "k",
   "cp": "U+006B",
   "name": "LATIN SMALL LETTER K"
  },
  {
   "key": "l",
   "glyph": "l",
   "cp": "U+006C",
   "name": "LATIN SMALL LETTER L"
  },
  {
   "key": "m",
   "glyph": "m",
   "cp": "U+006D",
   "name": "LATIN SMALL LETTER M"
  },
  {
   "key": "n",
   "glyph": "n",
   "cp": "U+006E",
   "name": "LATIN SMALL LETTER N"
  },
  {
   "key": "o",
   "glyph": "o",
   "cp": "U+006F",
   "name": "LATIN SMALL LETTER O"
  },
  {
   "key": "p",
   "glyph": "p",
   "cp": "U+0070",
   "name": "LATIN SMALL LETTER P"
  },
  {
   "key": "q",
   "glyph": "q",
   "cp": "U+0071",
   "name": "LATIN SMALL LETTER Q"
  },
  {
   "key": "r",
   "glyph": "r",
   "cp": "U+0072",
   "name": "LATIN SMALL LETTER R"
  },
  {
   "key": "s",
   "glyph": "s",
   "cp": "U+0073",
   "name": "LATIN SMALL LETTER S"
  },
  {
   "key": "t",
   "glyph": "t",
   "cp": "U+0074",
   "name": "LATIN SMALL LETTER T"
  },
  {
   "key": "u",
   "glyph": "u",
   "cp": "U+0075",
   "name": "LATIN SMALL LETTER U"
  },
  {
   "key": "v",
   "glyph": "v",
   "cp": "U+0076",
   "name": "LATIN SMALL LETTER V"
  },
  {
   "key": "w",
   "glyph": "w",
   "cp": "U+0077",
   "name": "LATIN SMALL LETTER W"
  },
  {
   "key": "x",
   "glyph": "x",
   "cp": "U+0078",
   "name": "LATIN SMALL LETTER X"
  },
  {
   "key": "y",
   "glyph": "y",
   "cp": "U+0079",
   "name": "LATIN SMALL LETTER Y"
  },
  {
   "key": "z",
   "glyph": "z",
   "cp": "U+007A",
   "name": "LATIN SMALL LETTER Z"
  },
  {
   "key": "iY",
   "glyph": "ɨ",
   "cp": "U+0268",
   "name": "LATIN SMALL LETTER I WITH STROKE"
  },
  {
   "key": "eY",
   "glyph": "ɘ",
   "cp": "U+0258",
   "name": "LATIN SMALL LETTER REVERSED E"
  },
  {
   "key": "uY",
   "glyph": "ʉ",
   "cp": "U+0289",
   "name": "LATIN SMALL LETTER U BAR"
  },
  {
   "key": "aY",
   "glyph": "ä",
   "cp": "U+00E4",
   "name": "LATIN SMALL LETTER A WITH DIAERESIS"
  },
  {
   "key": "oY",
   "glyph": "ɵ",
   "cp": "U+0275",
   "name": "LATIN SMALL LETTER BARRED O"
  },
  {
   "key": "yY",
   "glyph": "ƴ",
   "cp": "U+01B4",
   "name": "LATIN SMALL LETTER Y WITH HOOK (Fula)",
   "ipa": false
  },
  {
   "key": "2H",
   "glyph": "ʔ",
   "cp": "U+0294",
   "name": "LATIN LETTER GLOTTAL STOP"
  },
  {
   "key": "3H",
   "glyph": "ʕ",
   "cp": "U+0295",
   "name": "LATIN LETTER PHARYNGEAL VOICED FRICATIVE"
  },
  {
   "key": "4H",
   "glyph": "ɾ",
   "cp": "U+027E",
   "name": "LATIN SMALL LETTER R WITH FISHHOOK"
  },
  {
   "key": "5H",
   "glyph": "ə",
   "cp": "U+0259",
   "name": "LATIN SMALL LETTER SCHWA"
  },
  {
   "key": "aH",
   "glyph": "ɑ",
   "cp": "U+0251",
   "name": "LATIN SMALL LETTER ALPHA"
  },
  {
   "key": "7H",
   "glyph": "ħ",
   "cp": "U+0127",
   "name": "LATIN SMALL LETTER H WITH STROKE"
  },
  {
   "key": "bH",
   "glyph": "β",
   "cp": "U+03B2",
   "name": "GREEK SMALL LETTER BETA"
  },
  {
   "key": "cH",
   "glyph": "ç",
   "cp": "U+00E7",
   "name": "LATIN SMALL LETTER C WITH CEDILLA"
  },
  {
   "key": "dH",
   "glyph": "ð",
   "cp": "U+00F0",
   "name": "LATIN SMALL LETTER ETH"
  },
  {
   "key": "eH",
   "glyph": "ɛ",
   "cp": "U+025B",
   "name": "LATIN SMALL LETTER OPEN E"
  },
  {
   "key": "gH",
   "glyph": "ɣ",
   "cp": "U+0263",
   "name": "LATIN SMALL LETTER GAMMA"
  },
  {
   "key": "hH",
   "glyph": "ɦ",
   "cp": "U+0266",
   "name": "LATIN SMALL LETTER H WITH HOOK"
  },
  {
   "key": "iH",
   "glyph": "ɪ",
   "cp": "U+026A",
   "name": "LATIN LETTER SMALL CAPITAL I"
  },
  {
   "key": "oH",
   "glyph": "ɔ",
   "cp": "U+0254",
   "name": "LATIN SMALL LETTER OPEN O"
  },
  {
   "key": "pH",
   "glyph": "ɸ",
   "cp": "U+0278",
   "name": "LATIN SMALL LETTER PHI"
  },
  {
   "key": "qH",
   "glyph": "χ",
   "cp": "U+03C7",
   "name": "GREEK SMALL LETTER CHI"
  },
  {
   "key": "xH",
   "glyph": "ɧ",
   "cp": "U+0267",
   "name": "LATIN SMALL LETTER HENG WITH HOOK"
  },
  {
   "key": "rH",
   "glyph": "ɹ",
   "cp": "U+0279",
   "name": "LATIN SMALL LETTER TURNED R"
  },
  {
   "key": "sH",
   "glyph": "ʃ",
   "cp": "U+0283",
   "name": "LATIN SMALL LETTER ESH"
  },
  {
   "key": "tH",
   "glyph": "θ",
   "cp": "U+03B8",
   "name": "GREEK SMALL LETTER THETA"
  },
  {
   "key": "uH",
   "glyph": "ʊ",
   "cp": "U+028A",
   "name": "LATIN SMALL LETTER UPSILON"
  },
  {
   "key": "vH",
   "glyph": "ʋ",
   "cp": "U+028B",
   "name": "LATIN SMALL LETTER V WITH HOOK"
  },
  {
   "key": "wH",
   "glyph": "ʍ",
   "cp": "U+028D",
   "name": "LATIN SMALL LETTER TURNED W"
  },
  {
   "key": "yH",
   "glyph": "ʏ",
   "cp": "U+028F",
   "name": "LATIN LETTER SMALL CAPITAL Y"
  },
  {
   "key": "zH",
   "glyph": "ʒ",
   "cp": "U+0292",
   "name": "LATIN SMALL LETTER EZH"
  },
  {
   "key": "2Q",
   "glyph": "ʡ",
   "cp": "U+02A1",
   "name": "LATIN LETTER GLOTTAL STOP WITH STROKE"
  },
  {
   "key": "3Q",
   "glyph": "ʢ",
   "cp": "U+02A2",
   "name": "LATIN LETTER REVERSED GLOTTAL STOP WITH STROKE"
  },
  {
   "key": "7Q",
   "glyph": "ʜ",
   "cp": "U+029C",
   "name": "LATIN LETTER SMALL CAPITAL H"
  },
  {
   "key": "gQ",
   "glyph": "ɢ",
   "cp": "U+0262",
   "name": "LATIN LETTER SMALL CAPITAL G"
  },
  {
   "key": "nQ",
   "glyph": "ɴ",
   "cp": "U+0274",
   "name": "LATIN LETTER SMALL CAPITAL N"
  },
  {
   "key": "rQ",
   "glyph": "ʁ",
   "cp": "U+0281",
   "name": "LATIN LETTER SMALL CAPITAL INVERTED R"
  },
  {
   "key": "lQ",
   "glyph": "ɫ",
   "cp": "U+026B",
   "name": "LATIN SMALL LETTER L WITH MIDDLE TILDE"
  },
  {
   "key": "4L",
   "glyph": "ɺ",
   "cp": "U+027A",
   "name": "LATIN SMALL LETTER TURNED R WITH LONG LEG"
  },
  {
   "key": "sL",
   "glyph": "ɬ",
   "cp": "U+026C",
   "name": "LATIN SMALL LETTER L WITH BELT"
  },
  {
   "key": "zL",
   "glyph": "ɮ",
   "cp": "U+026E",
   "name": "LATIN SMALL LETTER LEZH"
  },
  {
   "key": "4R",
   "glyph": "ɽ",
   "cp": "U+027D",
   "name": "LATIN SMALL LETTER R WITH TAIL"
  },
  {
   "key": "dR",
   "glyph": "ɖ",
   "cp": "U+0256",
   "name": "LATIN SMALL LETTER D WITH TAIL"
  },
  {
   "key": "lR",
   "glyph": "ɭ",
   "cp": "U+026D",
   "name": "LATIN SMALL LETTER L WITH RETROFLEX HOOK"
  },
  {
   "key": "nR",
   "glyph": "ɳ",
   "cp": "U+0273",
   "name": "LATIN SMALL LETTER N WITH RETROFLEX HOOK"
  },
  {
   "key": "rR",
   "glyph": "ɻ",
   "cp": "U+027B",
   "name": "LATIN SMALL LETTER TURNED R WITH HOOK"
  },
  {
   "key": "sR",
   "glyph": "ʂ",
   "cp": "U+0282",
   "name": "LATIN SMALL LETTER S WITH HOOK"
  },
  {
   "key": "tR",
   "glyph": "ʈ",
   "cp": "U+0288",
   "name": "LATIN SMALL LETTER T WITH RETROFLEX HOOK"
  },
  {
   "key": "zR",
   "glyph": "ʐ",
   "cp": "U+0290",
   "name": "LATIN SMALL LETTER Z WITH RETROFLEX HOOK"
  },
  {
   "key": "4V",
   "glyph": "ⱱ",
   "cp": "U+2C71",
   "name": "LATIN SMALL LETTER V WITH RIGHT HOOK"
  },
  {
   "key": "mV",
   "glyph": "ɱ",
   "cp": "U+0271",
   "name": "LATIN SMALL LETTER M WITH HOOK"
  },
  {
   "key": "e%",
   "glyph": "ɜ",
   "cp": "U+025C",
   "name": "LATIN SMALL LETTER REVERSED OPEN E"
  },
  {
   "key": "o%",
   "glyph": "ɞ",
   "cp": "U+025E",
   "name": "LATIN SMALL LETTER CLOSED REVERSED OPEN E"
  },
  {
   "key": "a%",
   "glyph": "ɐ",
   "cp": "U+0250",
   "name": "LATIN SMALL LETTER TURNED A"
  },
  {
   "key": "aE",
   "glyph": "æ",
   "cp": "U+00E6",
   "name": "LATIN SMALL LETTER AE"
  },
  {
   "key": "oE",
   "glyph": "œ",
   "cp": "U+0153",
   "name": "LATIN SMALL LIGATURE OE"
  },
  {
   "key": "uA",
   "glyph": "ʌ",
   "cp": "U+028C",
   "name": "LATIN SMALL LETTER TURNED V"
  },
  {
   "key": "oA",
   "glyph": "ɒ",
   "cp": "U+0252",
   "name": "LATIN SMALL LETTER TURNED ALPHA"
  },
  {
   "key": "aW",
   "glyph": "ɶ",
   "cp": "U+0276",
   "name": "LATIN LETTER SMALL CAPITAL OE"
  },
  {
   "key": "eW",
   "glyph": "ø",
   "cp": "U+00F8",
   "name": "LATIN SMALL LETTER O WITH STROKE"
  },
  {
   "key": "oW",
   "glyph": "ɤ",
   "cp": "U+0264",
   "name": "LATIN SMALL LETTER RAMS HORN"
  },
  {
   "key": "uW",
   "glyph": "ɯ",
   "cp": "U+026F",
   "name": "LATIN SMALL LETTER TURNED M"
  },
  {
   "key": "wW",
   "glyph": "ɰ",
   "cp": "U+0270",
   "name": "LATIN SMALL LETTER TURNED M WITH LONG LEG"
  },
  {
   "key": "bP",